[
  {
    "$schema": "https://ils.test.rero.ch/schema/items_types/item_type-v0.0.1.json",
    "pid": "1",
    "name": "standard",
    "description": "standard checkout",
    "organisation_pid": "1"
  },
  {
    "$schema": "https://ils.test.rero.ch/schema/items_types/item_type-v0.0.1.json",
    "pid": "2",
    "name": "short",
    "description": "short checkout",
    "organisation_pid": "1"
  },
  {
    "$schema": "https://ils.test.rero.ch/schema/items_types/item_type-v0.0.1.json",
    "pid": "3",
    "name": "on-site",
    "description": "on-site checkout",
    "organisation_pid": "1"
  },
  {
    "$schema": "https://ils.test.rero.ch/schema/items_types/item_type-v0.0.1.json",
    "pid": "4",
    "name": "no-checkout",
    "description": "no checkout",
    "organisation_pid": "1"
  }
]
